{
  "schema_version": "1.0.0",
  "id": "catalog.fixture.1",
  "revision": 1,
  "captured_at": "2026-10-16T09:00:00Z",
  "items": [
    {
      "schema_version": "1.0.0",
      "id": "cat.workload.fixture",
      "kind": "workload",
      "tier": "T0",
      "name": "FICTIONAL Workload",
      "version": "2026.10-demo",
      "status": "active",
      "billing_class": "included",
      "spec": {
        "workload_type": "agentic",
        "modalities": [
          "text"
        ],
        "concurrency": 2,
        "requests_per_day": 200,
        "avg_input_tokens": 700,
        "avg_output_tokens": 400,
        "data_classification": "internal"
      },
      "provenance": [
        {
          "checked_at": "2026-10-16T09:00:00Z",
          "verification_status": "user_supplied",
          "notes": "FICTIONAL TEST FIXTURE. Not vendor specification or commercial pricing."
        }
      ],
      "updated_at": "2026-10-16T09:00:00Z"
    },
    {
      "schema_version": "1.0.0",
      "id": "cat.deployment_mode.fixture",
      "kind": "deployment_mode",
      "tier": "T0",
      "name": "FICTIONAL Deployment Mode",
      "version": "2026.10-demo",
      "status": "active",
      "billing_class": "included",
      "spec": {
        "mode": "self_hosted",
        "allowed_regions": [
          "us-east-fixture"
        ]
      },
      "provenance": [
        {
          "checked_at": "2026-10-16T09:00:00Z",
          "verification_status": "user_supplied",
          "notes": "FICTIONAL TEST FIXTURE. Not vendor specification or commercial pricing."
        }
      ],
      "updated_at": "2026-10-16T09:00:00Z"
    },
    {
      "schema_version": "1.0.0",
      "id": "cat.model_provider.fixture",
      "kind": "model_provider",
      "tier": "T1",
      "name": "FICTIONAL Model Provider",
      "version": "2026.10-demo",
      "status": "active",
      "billing_class": "included",
      "spec": {
        "supports_fine_tuning": true,
        "supported_regions": [
          "us-east-fixture"
        ]
      },
      "provenance": [
        {
          "checked_at": "2026-10-16T09:00:00Z",
          "verification_status": "user_supplied",
          "notes": "FICTIONAL TEST FIXTURE. Not vendor specification or commercial pricing."
        }
      ],
      "updated_at": "2026-10-16T09:00:00Z"
    },
    {
      "schema_version": "1.0.0",
      "id": "cat.model.fixture",
      "kind": "model",
      "tier": "T1",
      "name": "FICTIONAL Model",
      "version": "2026.10-demo",
      "status": "active",
      "billing_class": "included",
      "spec": {
        "provider_ref": "cat.model_provider.fixture",
        "model_type": "generative",
        "modalities_in": [
          "text"
        ],
        "modalities_out": [
          "text"
        ],
        "context_window_tokens": 8192,
        "max_output_tokens": 1024,
        "supports_tool_calling": true,
        "supports_json_schema": true,
        "supports_fine_tuning": true,
        "access_modes": [
          "weights"
        ],
        "weight_access": "open",
        "model_formats": [
          "safetensors"
        ],
        "supported_precisions": [
          "fp16",
          "int8"
        ],
        "min_weights_vram_gb": 12
      },
      "license": {
        "spdx_id": "TEST-ONLY",
        "commercial_use_allowed": true,
        "self_hosting_allowed": true
      },
      "provenance": [
        {
          "checked_at": "2026-10-16T09:00:00Z",
          "verification_status": "user_supplied",
          "notes": "FICTIONAL TEST FIXTURE. Not vendor specification or commercial pricing."
        }
      ],
      "updated_at": "2026-10-16T09:00:00Z"
    },
    {
      "schema_version": "1.0.0",
      "id": "cat.context_policy.fixture",
      "kind": "context_policy",
      "tier": "T1",
      "name": "FICTIONAL Context Policy",
      "version": "2026.10-demo",
      "status": "active",
      "billing_class": "included",
      "spec": {
        "max_allowed_tokens": 8192,
        "supported_truncation": [
          "reject",
          "truncate_oldest"
        ]
      },
      "provenance": [
        {
          "checked_at": "2026-10-16T09:00:00Z",
          "verification_status": "user_supplied",
          "notes": "FICTIONAL TEST FIXTURE. Not vendor specification or commercial pricing."
        }
      ],
      "updated_at": "2026-10-16T09:00:00Z"
    },
    {
      "schema_version": "1.0.0",
      "id": "cat.hosting_platform.fixture",
      "kind": "hosting_platform",
      "tier": "T2",
      "name": "FICTIONAL Hosting Platform",
      "version": "2026.10-demo",
      "status": "active",
      "billing_class": "included",
      "spec": {
        "hosting_type": "cloud",
        "regions": [
          "us-east-fixture"
        ],
        "accelerator_refs": [
          "cat.accelerator.fixture"
        ],
        "supports_private_networking": true
      },
      "provenance": [
        {
          "checked_at": "2026-10-16T09:00:00Z",
          "verification_status": "user_supplied",
          "notes": "FICTIONAL TEST FIXTURE. Not vendor specification or commercial pricing."
        }
      ],
      "updated_at": "2026-10-16T09:00:00Z"
    },
    {
      "schema_version": "1.0.0",
      "id": "cat.accelerator.fixture",
      "kind": "accelerator",
      "tier": "T2",
      "name": "FICTIONAL Accelerator",
      "version": "2026.10-demo",
      "status": "active",
      "billing_class": "included",
      "spec": {
        "accelerator_type": "gpu",
        "vendor": "Fixture Hardware Inc.",
        "model_name": "Demo GPU 24",
        "vram_gb": 24,
        "backends": [
          "cuda"
        ],
        "precisions": [
          "fp16",
          "int8"
        ],
        "interconnect": "pcie"
      },
      "provenance": [
        {
          "checked_at": "2026-10-16T09:00:00Z",
          "verification_status": "user_supplied",
          "notes": "FICTIONAL TEST FIXTURE. Not vendor specification or commercial pricing."
        }
      ],
      "updated_at": "2026-10-16T09:00:00Z"
    },
    {
      "schema_version": "1.0.0",
      "id": "cat.compute_profile.fixture",
      "kind": "compute_profile",
      "tier": "T2",
      "name": "FICTIONAL Compute Profile",
      "version": "2026.10-demo",
      "status": "active",
      "billing_class": "metered",
      "spec": {
        "hosting_ref": "cat.hosting_platform.fixture",
        "accelerator_ref": "cat.accelerator.fixture",
        "accelerator_count": 1,
        "cpu_cores": 8,
        "ram_gb": 64,
        "disk_gb": 300,
        "region": "us-east-fixture"
      },
      "provenance": [
        {
          "checked_at": "2026-10-16T09:00:00Z",
          "verification_status": "user_supplied",
          "notes": "FICTIONAL TEST FIXTURE. Not vendor specification or commercial pricing."
        }
      ],
      "updated_at": "2026-10-16T09:00:00Z"
    },
    {
      "schema_version": "1.0.0",
      "id": "cat.inference_engine.fixture",
      "kind": "inference_engine",
      "tier": "T2",
      "name": "FICTIONAL Inference Engine",
      "version": "2026.10-demo",
      "status": "active",
      "billing_class": "included",
      "spec": {
        "backends": [
          "cuda"
        ],
        "model_formats": [
          "safetensors"
        ],
        "supported_precisions": [
          "fp16",
          "int8"
        ],
        "supports_tool_calling": true,
        "supports_multi_gpu": true,
        "max_batch_size": 8
      },
      "provenance": [
        {
          "checked_at": "2026-10-16T09:00:00Z",
          "verification_status": "user_supplied",
          "notes": "FICTIONAL TEST FIXTURE. Not vendor specification or commercial pricing."
        }
      ],
      "updated_at": "2026-10-16T09:00:00Z"
    },
    {
      "schema_version": "1.0.0",
      "id": "cat.storage.fixture",
      "kind": "storage",
      "tier": "T2",
      "name": "FICTIONAL Storage",
      "version": "2026.10-demo",
      "status": "active",
      "billing_class": "metered",
      "spec": {
        "storage_type": "object",
        "hosting_ref": "cat.hosting_platform.fixture",
        "region": "us-east-fixture",
        "encryption_at_rest": true,
        "max_capacity_gb": 2000
      },
      "provenance": [
        {
          "checked_at": "2026-10-16T09:00:00Z",
          "verification_status": "user_supplied",
          "notes": "FICTIONAL TEST FIXTURE. Not vendor specification or commercial pricing."
        }
      ],
      "updated_at": "2026-10-16T09:00:00Z"
    },
    {
      "schema_version": "1.0.0",
      "id": "cat.data_source.fixture",
      "kind": "data_source",
      "tier": "T3",
      "name": "FICTIONAL Data Source",
      "version": "2026.10-demo",
      "status": "active",
      "billing_class": "included",
      "spec": {
        "source_type": "file",
        "modalities": [
          "text"
        ],
        "classification": "internal",
        "refresh_supported": true,
        "access_controlled": true
      },
      "provenance": [
        {
          "checked_at": "2026-10-16T09:00:00Z",
          "verification_status": "user_supplied",
          "notes": "FICTIONAL TEST FIXTURE. Not vendor specification or commercial pricing."
        }
      ],
      "updated_at": "2026-10-16T09:00:00Z"
    },
    {
      "schema_version": "1.0.0",
      "id": "cat.knowledge_base.fixture",
      "kind": "knowledge_base",
      "tier": "T3",
      "name": "FICTIONAL Knowledge Base",
      "version": "2026.10-demo",
      "status": "active",
      "billing_class": "included",
      "spec": {
        "data_source_refs": [
          "cat.data_source.fixture"
        ],
        "supported_modalities": [
          "text"
        ],
        "supports_acl": true,
        "supports_incremental_sync": true
      },
      "provenance": [
        {
          "checked_at": "2026-10-16T09:00:00Z",
          "verification_status": "user_supplied",